elevatorAddress,unloadCapacity,lat,loadCapacity,odhiRegion,propertyTypeCategory,cert,transportTypes,shortName,propertyType,capacity,lng,fullName
"27340, вул. Вокзальна, буд. 18, с. Михайлівка, Олександрівський р-н., Кіровоградська обл.",800,48.8330556,500,Кіровоградська,Інші,5276,"train,autocar","Цибулівське ХПП, ТДВ",Приватний,13200,32.3958333,"Товариство з додатковою відповідальністю ""Цибулівське хлібоприймальне підприємство"""
"72312, вул. Фрунзе, буд. 53, м. Мелітополь, Запорізька обл.",900,46.8333333,1000,Запорізька,Інші,5277,"train,autocar","ЖЕЛЄВ С.С. І КОМПАНІЯ МЕЛІТОПОЛЬСЬКОГО ЕЛЕВАТОРА, КТ",Приватний,76000,35.3666667,"Командитне товариство ""ЖЕЛЄВ С.С. І КОМПАНІЯ ""МЕЛІТОПОЛЬСЬКОГО ЕЛЕВАТОРА"""
"73024, вул. Порт-Елеватор, буд. 5, м. Херсон  ",8000,46.633997,6000,Херсонська,Інші,5278,"train,autocar,ship,barge","Херсонський КХП, ПАТ (м. Херсон)",Приватний,96200,32.629631,"Публічне акціонерне товариство ""Херсонський комбінат хлібопродуктів"""
"20630, вул. Калініна, буд. 1а, с. Матусів, Шполянський р-н., Черкаська обл.",250,49.0502778,250,Черкаська,Інші,5279,autocar,"Агрофірма Вись, СТОВ",Приватний,7000,31.5608333,"Сільськогосподарське товариство з обмеженою відповідальністю ""Агрофірма Вись"""
"12452, вул. Гагаріна, буд. 2, с. Кодня, Житомирський р-н., Житомирська обл.",1200,50.0872222,1100,Житомирська,Інші,5280,"train,autocar","Житомирський КХП, ПАТ (с. Кодня)",Приватний,4500,28.6944444,"Публічне акціонерне товариство ""Житомирський комбінат хлібопродуктів"""
"10001, пров. Іподромний 2, буд. 3а, м. Житомир   ",1200,50.2768136,1100,Житомирська,Інші,5281,"train,autocar","Житомирський КХП, ПАТ (м. Житомир)",Приватний,10900,28.6882331,"Публічне акціонерне товариство ""Житомирський комбінат хлібопродуктів"""
"13300, вул. Ватутіна, буд. 10, м. Бердичів, Житомирська обл.",1440,49.920566,1440,Житомирська,Інші,5282,"train,autocar","Бердичівська солодова компанія, ТОВ",Приватний,24000,28.598892,"Товариство з обмеженою відповідальністю ""Бердичівська солодова компанія"""
"44810, вул. Смідинська, буд. 6, смт. Луків, Турійський р-н., Волинсська обл.",1500,51.2333333,1500,Волинська,Інші,5283,"train,autocar","Міленіум, ТОВ",Приватний,15000,24.3475000,"Товариство з обмеженою відповідальністю ""Міленіум"""
"37710, вул. Леніна, буд. 79. с. Лазірки. Оржицький р-н., Полтавська обл.",650,50.083004,600,Полтавська,Інші,5284,"train,autocar","Кононівський елеватор, ТОВ",Приватний,18200,32.655787,"Товариство з обмеженою відповідальністю ""Кононівський елеватор"""
"37001, вул. Урожайна, буд. 12, м. Пирятин,  Полтавська обл.",720,50.2373930,800,Полтавська,Інші,5285,"train,autocar","СПКЗ, ТОВ",Приватний,25800,32.504928,"Товариство з обмеженою відповідальністю ""Сільськогосподарське підприємство комбікормовий завод"""
"37010, пров. Ватутіна, буд. 18, с. Давидівка, Пирятинський р-н., Полтавська обл.",1200,49.4434877,1500,Полтавська,Інші,5286,"train,autocar","ВАСІЛКО, ТОВ",Приватний,17000,34.1679127,"Товариство з обмеженою відповідальністю ""ВАСІЛКО"""
"37240, вул. Ватутіна, буд. 2а, м. Червонозаводське, Лохвицький р-н., Полтавська обл.",700,50.4022710,400,Полтавська,Інші,5287,"train,autocar","Амарант, ТОВ (дільниця № 2)",Приватний,30000,33.389124,"Товариство з обмеженою відповідальністю ""Амарант"""
"37233, вул Чапаєва, буд. 59а, с. Піски, Лохвицький р-н., Полтавська обл.",1200,50.3715500,2000,Полтавська,Інші,5288,"train,autocar","Амарант, ТОВ (дільниця № 3)",Приватний,25000,33.4512410,"Товариство з обмеженою відповідальністю ""Амарант"""
"37222, вул. Лучанська, буд. 1б, с. Юсківці, Лохвицький р-н., Полтавська обл.",1100,50.468049,1400,Полтавська,Інші,5289,"train,autocar","Амарант, ТОВ (дільниця № 1)",Приватний,110000,33.331479,"Товариство з обмеженою відповідальністю ""Амарант"""
"38832, пров. Хлібний, буд. 25, с. Чапаєве, Чутівський р-н., Полтавська обл.",1200,49.7407839,1500,Полтавська,Державні,5294,"train,autocar","Полтавський КХП, ДП ДАРУ (філія ""Хлібна база №88"", с. Чапаєве)",ДАРУ,41350,34.9897214,"Державне підприємство ""Полтавський комбінат хлібопродуктів"" Державного агенства резерву України"
"38762, вул. Шевченка, буд. 3а, с.Терешки, Полтавський р-н., Полтавська обл.",1760,49.5530283,1300,Полтавська,Інші,5295,"train,autocar","Полтава-Сад, ТОВ",Приватний,21000,34.6198930,"Товариство з обмеженою відповідальністю ""Полтава- Сад"" "
"38813, вул. Першотравнева, буд. 9а, смт. Артемівка, Чутівський р-н., Полтавська обл.",3700,49.7712069,6000,Полтавська,Державні,5296,"train,autocar","Полтавський КХП, ДП ДАРУ (філія ""Хлібна база №88"", смт. Артемівка)",ДАРУ,115400,35.0646650,"Державне підприємство ""Полтавський комбінат хлібопродуктів"" Державного агенства резерву України"
"87321, вул. Лермонтова, буд. 1, смт. Кутейникове, Амвросіївський р-н., Донецька обл.",900,47.8109167,900,Донецька,Державні,5298,"train,autocar","Комбінат Новий, ДО ДАРУ",ДАРУ,25000,38.2916667,"Державна організація Комбінат ""Новий"""
"85107, вул. Докучаєва, буд. 1, с. Бересток, Костянтинівський р-н., Донецька обл.",250,48.4758333,250,Донецька,Інші,5299,autocar,"Константа Агро, ТОВ",Приватний,10000,37.6966667,"Товариство з обмеженою відповідальністю ""Константа Агро"""
"67555, вул. Миру, буд. 17 б, с. Сичавка, Комінтернівський р-н., Одеська обл.",400,46.6397222,500,Одеська,Інші,5300,autocar,"Амбер Агро, ТОВ",Приватний,5000,31.1016667,"Товариство з обмеженою відповідальністю ""Амбер Агро"""
"24450, вул. Промислова, буд. 1, с. Джулинка, Бершадський р-н., Вінницька обл.",800,48.4416667,1000,Вінницька,Інші,5301,"train,autocar","Джулинський елеватор, ТОВ",Приватний,28000,29.7475000,"Товариство з обмеженою відповідальністю ""Джулинський елеватор"""
"80040, вул. 1-го Травня, буд. 4, смт. Жвирка, Сокальський р-н., Львівська обл.",660,50.4650000,660,Львівська,Інші,5302,"train,autocar","Західний Буг, ПП",Приватний,17000,24.2566667,"Приватне підприємство ""Західний Буг"""
"81500, вул. Заводська, буд. 14, м. Городок, Львівська обл.",700,49.7822222,900,Львівська,Інші,5303,"train,autocar","АПП Львівське, ТОВ",Приватний,12500,23.6436111,"Товариство з обмеженою відповідальністю ""Агропромислове підприємство ""Львівське"""
"64641, вул. Індустріальна, буд. 12, смт. Орілька, Лозівський р-н., Харківська обл.",1000,48.9805000,2000,Харківська,Інші,5304,"train,autocar","Агросвіт АПК, ТОВ (Орільський елеватор)",Приватний,65000,36.0075000,"Товариство з обмеженою відповідальністю ""Агропромислова компанія ""Агросвіт"""
"63543, пров. Перемоги, буд. 1, с. Залізничне, Чугуївський р-н., Харківська обл.",3000,49.7238889,3600,Харківська,Інші,5305,"train,autocar","Агросвіт АПК, ТОВ (Граківський елеватор)",Приватний,115000,36.8683333,"Товариство з обмеженою відповідальністю ""Агропромислова компанія ""Агросвіт"""
"09107, вул. Привокзальна, буд. 8, м.Біла Церква, Київська обл.",4000,49.804432,2900,Київська,Інші,5306,"train,autocar","Білоцерківський елеватор, ПАТ",Приватний,74800,30.122999,"Публічне акціонерне товариство ""Білоцерківський елеватор"""
"16000, вул. Вокзальна, буд. 15, м. Новгород-Сіверський, Чернігівська обл.",400,51.996828,360,Чернігівська,Інші,5308,"train,autocar","Новгород-Сіверський Елеватор, ТОВ",Приватний,7500,33.26584,"Товариство з обмеженою відповідальністю ""Новгород-Сіверський Елеватор"""
"67200, Промзона, смт. Іванівка, Одеська обл.",5500,46.9662960,6000,Одеська,Державні,5309,"train,autocar","Хлібна база № 77, ДП ДАРУ",ДАРУ,100000,30.4715280,"Державне підприємство ""Хлібна база № 77"" Державного агенства резерву України"
"38413, вул. Степова, буд. 33в, с. Жовтневе, Решетилівський р-н., Полтавська обл.",1000,49.6431885,500,Полтавська,Інші,5310,"train,autocar","Подоляка, ПАФ",Приватний,60000,34.1399971,"Приватна Агрофірма ""Подоляка"""
"54025, пр-кт. Героїв Сталінграду, буд. 117, м. Миколаїв  ",500,46.9964710,500,Миколаївська,Інші,5311,autocar,"ЗПК Інтерагротранс, ТОВ",Приватний,34140,31.9975088,"Товариство з обмеженою відповідальністю ""Зерноприймальний комплекс ""Інтерагротранс"""
"55310, вул. Елеваторна, буд. 10, с. Кавуни, Арбузинський р-н., Миколаївська обл.",3300,47.9058333,6300,Миколаївська,Державні,5312,"train,autocar","Хлібна база № 76, ДП ДАРУ",ДАРУ,199500,31.2763889,"Державне підприємство ""Хлібна база № 76"" Державного агенства резерву України"
"74721, вул. Миру, буд. 1. с. Сірогози, Нижньосірогозький р-н., Херсонська обл.",1100,46.943348,2000,Херсонська,Власники 6+,5313,"train,autocar","НЗК, ТОВ (філія Сірогозький КХП)",Нікопольська ЗК,31000,34.377379,"Товариство з обмеженою відповідальністю ""Нікопольська зернова компанія"""
"41668, вул. Комунарівська, буд. 50, с. Заводи, Конотопський р-н., Сумська обл.",600,51.278756,1500,Сумська,Інші,5314,autocar,"Вітчизна, ТОВ (с. Заводи)",Приватний,12000,33.179419,"Товариство з обмеженою відповідальністю ""Вітчизна"""
"47732, вул. Лисенка, буд. 1, с. Мишковичі, Тернопільський  р-н., Тернопільська обл.",800,49.4463889,800,Тернопільська,Інші,5316,autocar,"Комбікормтрейд, ТОВ",Приватний,20000,25.6075000,"Товариство з обмеженою відповідальністю ""Комбікормтрейд"""
"62053, вул. Підлісна, буд. 2, с. Водяне, Краснокутський р-н., Харківська обл.",600,49.9282560,1000,Харківська,Власники 6+,5317,"train,autocar","Водянське ХПП, ТОВ",Агротрейд,31800,35.3658186,"Товариство з обмеженою відповідальністю ""Водянське хлібоприймальне підприємство"""
"64408, вул. Пушкіна, буд. 33, с. Нагірне, Зачепилівський р-н., Харківська обл. ",1400,49.2127778,1500,Харківська,Власники 6+,5318,"train,autocar","Зачепилівське ХПП, ТОВ",Агротрейд,42500,35.2244444,"Товариство з обмеженою відповідальністю ""Зачепилівське хлібоприймальне підприємство"""
"64801, вул, Комсомольська, буд. 11, смт. Близнюки, Близнюківський р-н., Харківська обл.",990,48.8561135,1200,Харківська,Власники 6+,5319,"train,autocar","Близнюківський КХП, ТОВ",Агротрейд,42500,36.5566225,"Товариство з обмеженою відповідальністю ""Близнюківський комбінат хлібопродуктів"""
"63702, вул. Дзержинського, буд. 49, м. Куп\'янськ,  Харківська обл.",1350,49.7053320,1400,Харківська,Власники 6+,5320,"train,autocar","Куп\'янський КХП, ТОВ (потокова лінія)",Агротрейд,25600,37.5988680,"Товариство з обмеженою відповідальністю ""Куп\'янський комбінат хлібопродуктів"""
"63131, вул. Свердлова,  буд. 1, с. Шелестове,  Коломацький р-н., Харківська обл.",620,49.8591667,1220,Харківська,Власники 6+,5321,"train,autocar","Коломацьке ХПП, ТОВ",Агротрейд,36000,35.2155556,"Товариство з обмеженою відповідальністю ""Коломацьке хлібоприймальне підприємство"""
"52532, вул. Залізнична, буд. 4, с. Роздори, Синельніковський р-н., Дніпропетровська обл.",750,48.3285360,1100,Дніпропетровська,Інші,5322,"train,autocar","Роздорський елеватор, ТОВ",Приватний,12000,35.7044520,"Товариство з обмеженою відповідальністю ""Роздорський елеватор"""
"51700, вул. Привокзальна, буд. 1а, м. Вільногірськ,  Дніпропетровська обл.",1800,48.4833333,1500,Дніпропетровська,Інші,5323,"train,autocar","Вільногірський елеватор, ДП ТОВ ""Зернопром""",Приватний,29400,34.0166667,"Дочірнє підприємство ""Вільногірський елеватор"" Товариства з обмеженою відповідальністю ""Зернопром"""
"11500, вул. Жовтнева, буд. 60, м. Коростень, Житомирська обл.",500,50.972506,1100,Житомирська,Інші,5325,"train,autocar","Коростенський КХП, ТДВ",Приватний,12400,28.659508,"Товариство з додатковою відповідальністю ""Коростенський комбінат хлібопродуктів"""
"68800, вул. Дунайська, буд. 188в, м. Рені, Одеська обл.",2000,45.4500000,1800,Одеська,Інші,5326,"train,autocar,ship,barge","Рені-Лайн, ТОВ",Приватний,19384,28.2833333,"Товариство з обмеженою відповідальністю ""Рені-Лайн"""
"22800, вул. Леніна, буд. 226а, м. Немирів, Вінницька обл.",1620,48.9726621,840,Вінницька,Інші,5327,"train,autocar","Вінницька промислова група СХК, ТОВ (Немирівський елеватор)",Приватний,57000,28.836666,"Товариство з обмеженою відповідальністю ""СХК ""Вінницька Промислова група"""
"86002, вул. Октябрська, буд. 97, м. Ясинувата, Донецька обл.",750,48.122155,1180,Донецька,Інші,5328,"train,autocar","ПО Ясинуватський КХП, КТ",Приватний,18500,37.876602,"Командитне товариство ""ПО Ясинуватський комбінат хлібопродуктів"""
"17580, вул. Прилуцька, буд. 19, с. Івківці, Прилуцький р-н., Чернігівська обл.",4200,50.5300000,4000,Чернігівська,Інші,5329,"train,autocar","Елеватор Агро, ТОВ",Приватний,232200,32.4933333,"Товариство з обмеженою відповідальністю ""Елеватор Агро"""
"70300, вул. Вокзальна, буд. 72, смт. Розівка, Розівський р-н., Запорізька обл.",1500,47.371926,2000,Запорізька,Власники 6+,5330,"train,autocar","Розівський елеватор, ПАТ (філія Розівський ХПП)",Розівський елеватор,28500,37.053789,"Публічне акціонерне товариство ""Розівський елеватор"""
"19634, вул. Польова, буд. 4, с. Хацьки, Черкаський р-н., Черкаська обл.",550,49.2942520,800,Черкаська,Власники 6+,5331,"train,autocar","НЗК, ТОВ (філія Білозірська реалізаційна база хлібопродуктів)",Нікопольська ЗК,45600,31.9414930,"Товариство з обмеженою відповідальністю ""Нікопольська зернова компанія"""
"39430, вул. Радянська, буд. 2, с. Селещина, Машівський р-н., Полтавська обл.",500,49.4586903,250,Полтавська,Інші,5332,"train,autocar","Дельта, ТОВ",Приватний,10000,34.8288953,"Товариство з обмеженою відповідальністю ""Дельта"""
"48130, вул. Л. Українки, буд. 13, смт. Дружба, Теребовлянський р-н., Тернопільська обл.",800,49.3608333,1680,Тернопільська,Інші,5333,"train,autocar","Теребовлянський КХП, ПАТ",Приватний,39000,25.6469444,"Відкрите акціонерне товариство ""Теребовлянський комбінат хлібопродуктів"""
"36022, вул. Леніна, буд. 69, м. Полтава   ",1200,49.578303,1900,Полтавська,Державні,5334,"train,autocar","Полтавський КХП, ДП ДАРУ (вул. Леніна)",ДАРУ,25200,34.576721,"Державне підприємство ""Полтавський комбінат хлібопродуктів"" Державного агенства резерву України"
"42006, вул. Прокопенка, буд. 10, м. Ромни,  Сумська обл.",960,50.7456220,1200,Сумська,Державні,5335,"train,autocar","Роменський КХП, ДП ДАК ""Хліб України""",ДАК,28200,33.4915160,"Дочірнє підприємство Державної акціонерної компанії ""Хліб України"" ""Роменський комбінат хлібопродуктів"""
"28327, вул. Дружби, буд. 14, с. Рядове, Петрівський р-н., Кіровоградська обл.",2700,48.2338889,2700,Кіровоградська,Власники 6+,5336,"train,autocar","НЗК, ТОВ (філія Рядівський елеватор)",Нікопольська ЗК,42000,33.5347222,"Товариство з обмеженою відповідальністю ""Нікопольська зернова компанія"""
"31200, вул. Котовського, буд. 8а, м. Волочиськ, Хмельницька обл.",560,49.5289850,560,Хмельницька,Інші,5337,"train,autocar","Агробізнес, ТОВ",Приватний,12900,26.2084090,"Товариство з обмеженою відповідальністю ""Агробізнес"""
"73036, вул. Перекопська, буд. 169, м. Херсон",1000,46.659393,500,Херсонська,Інші,5338,"autocar,ship,barge","Вторметекспорт, ТОВ",Приватний,3500,32.653813,"Товариство з обмеженою відповідальністю ""Вторметекспорт"""
"80400, вул. Шевченка, буд. 129а, м. Кам\'янка-Бузька, Львівська обл.  ",400,50.1000000,500,Львівська,Інші,5339,autocar,"Кам\'янка-Бузький ККЗ, ТзОВ",Приватний,12000,24.3500000,"Товариство з обмеженою відповідальністю ""Кам\'янка-Бузький комбікормовий завод"""
"27300, вул. Залізнична, буд. 1б, смт. Олександрівка, Олександрівський р-н.,Кіровоградська обл.",300,48.9666667,300,Кіровоградська,Інші,5340,"train,autocar","Дєдов, СФГ",Приватний,15000,32.2333333,"Селянське (Фермерське) Господарство ""Дєдов"""
"53742, вул. Центральна, буд. 1а, с. Карпівка, Широківський р-н., Дніпропетровська обл.",700,47.6660073,480,Дніпропетровська,Інші,5341,"train,autocar","Новоінгулецьке ХПП, СП ТОВ",Приватний,40000,33.1194431,"Товариство з обмеженою відповідальністю ""Сільськогосподарське підприємство ""Новоінгулецьке ХПП"""
"75033, вул. 50 років Жовтня, буд. 2а, с. Микільське, Білозерський р-н., Херсонська обл.",1300,46.7227778,500,Херсонська,Інші,5342,"autocar,barge","Херсонський КХП, ПАТ (Микільське ХПП)",Приватний,12900,32.8041667,"Публічне акціонерне товариство ""Херсонський комбінат хлібопродуктів"""
"75010, ст. Копані, Посад-Покровська сільська Рада, Білозерський р-н., Херсонська обл.",300,46.810018,500,Херсонська,Інші,5343,autocar,"Херсонський КХП, ПАТ (Копанське ХПП)",Приватний,21800,32.304976,"Публічне акціонерне товариство ""Херсонський комбінат хлібопродуктів"""
"98403, вул. Степова, буд. 2, м. Бахчисарай, АР Крим ",400,44.761708,800,АР Крим,Інші,5344,autocar,"Бахчисарайський ККЗ, ТОВ",Приватний,15000,33.846569,"Товариство з обмеженою відповідальністю ""Бахчисарайський комбікормовий завод"""
