elevatorAddress,unloadCapacity,lat,loadCapacity,odhiRegion,propertyTypeCategory,cert,transportTypes,shortName,propertyType,capacity,lng,fullName
"11104, вул. Леніна, буд. 72, м. Овруч, Житомирська обл.",380,51.3278320,200,Житомирська,Інші,4951,"train,autocar","Овруцька реалбаза хлібопродуктів, ВАТ",Приватний,14000,28.8133440,"Відкрите акціонерне товариство ""Овруцька реалізаційна база хлібопродуктів"""
"96020, вул. Леніна, буд. 55б, с. Воїнка, Красноперекопський р-н., АР Крим",1500,45.8693529,5320,АР Крим,Інші,4960,"train,autocar","Північно-Кримський КХП, ТОВ  (с. Воїнка)",Приватний,41900,33.9935460,"Товариство з обмеженою відповідальністю ""Північно-Кримський комбінат хлібопродуктів"""
"20603, вул. Калініна, буд. 1, м. Шпола, Черкаська обл.",4000,49.0042010,6000,Черкаська,Державні,4961,"train,autocar","ДПЗКУ, ПАТ (філія ""Шполянський елеватор"")",ДПЗКУ,71900,31.3962280,"Публічне акціонерне товариство ""Державна продовольчо-зернова корпорація України"""
"74800, Чаплинське шосе, буд. 19, м. Каховка, Каховський р-н., Херсонська обл.",250,46.8098389,450,Херсонська,Інші,4968,autocar,"Чумацький шлях, ТОВ",Приватний,12500,33.4830770,"Товариство з обмеженою відповідальністю ""Чумацький шлях"""
"38832, пров. Аптечний, буд. 11, с. Чапаєве, Чутівський р-н., Полтавська обл.",760,49.7407839,400,Полтавська,Інші,4970,"train,autocar","Інтер-Агро ЛТД ТД, ТОВ (с. Чапаєве)",Приватний,16300,34.9887214,"Товариство з обмеженою відповідальністю ""Торговий дім ""Інтер-Агро ЛТД"""
"37000, вул. Південна, буд. 4, м. Пирятин, Полтавська обл.",2000,50.2373930,1000,Полтавська,Інші,4971,"train,autocar","Баришівська зернова компанія, ТОВ (м. Пирятин)",Приватний,23100,32.5039280,"Товариство з обмеженою відповідальністю ""Баришівська зернова компанія"""
"20300, вул. Старицького, буд. 7, м. Умань, Черкаська обл.",3500,48.732134,8000,Черкаська,Державні,4983,"train,autocar","ДПЗКУ, ПАТ (філія ""Уманський елеватор"")",ДПЗКУ,97000,30.203433,"Публічне акціонерне товариство ""Державна продовольчо-зернова корпорація України"""
"20600, вул. Володарського, буд. 109, м. Шпола, Шполянський р-н., Черкаська обл.",1000,49.0042010,1000,Черкаська,Інші,4984,autocar,"Відродження, СПОП",Приватний,10000,31.397228,"Сільськогосподарське приватно-орендне підприємство ""Відродження"""
"вул. Шевченка 14, смт.Локачі, Локачинський район, Волинська область, 45300",380,51.3278320,250,Волинська,Інші,4985,autocar,"Агротехніка, ТзОВ",Приватний,15200,28.8133440,"Товариство з обмеженою відповідальністю ""Агротехніка"""
"20505, вул. Леніна, буд. 47, смт. Єрки, Катеринопільський р-н., Черкаська обл.",2500,48.9825000,4700,Черкаська,Інші,4990,"train,autocar","Катеринопільський елеватор, ТОВ",Приватний,220300,30.9991667,"Товариство з обмеженою відповідальністю ""Катеринопільський елеватор"""
"вул. Паралельна 33, смт.Турійськ, Турійський район, Волинська область, 44800",150,51.3278320,480,Волинська,Інші,4994,"train,autocar","Агротехніка, ТзОВ",Приватний,35990,28.8133440,"Товариство з обмеженою відповідальністю ""Агротехніка"""
"45653, вул. Привокзальна 156, с.Чаруків, Луцький район, Волинська область",300,51.3278320,750,Волинська,Інші,4997,"train,autocar","Агротехніка, ТзОВ",Приватний,25000,28.8133440,"Товариство з обмеженою відповідальністю ""Агротехніка"""
"27410, вул. Степова, буд. 3, смт. Знам\'янка друга, Кіровоградська обл.",550,48.7163889,750,Кіровоградська,Інші,5005,autocar,"Знам\'янська АПК, ТОВ",Приватний,19500,32.5930556,"Товариство з обмеженою відповідальністю ""Знам\'янська агропромислова компанія"""
"15600, вул. Садова, буд. 5, м. Мена, Чернігівська обл.",900,51.5199730,2000,Чернігівська,Державні,5018,"train,autocar","ДПЗКУ, ПАТ (філія ""Менське ХПП"")",ДПЗКУ,53000,32.2152340,"Публічне акціонерне товариство ""Державна продовольчо-зернова корпорація України"""
"26232, вул. Горького, буд. 25а, с. Злинка. Маловисківський р-н., Кіровоградська обл.",1500,48.491184,1500,Кіровоградська,Державні,5019,"train,autocar","ДПЗКУ, ПАТ (філія ""Хлібна база № 78"")",ДПЗКУ,172300,31.537628,"Публічне акціонерне товариство ""Державна продовольчо-зернова корпорація України"""
"20615, вул. Гагаріна, буд. 1, с. Сигнаївка, Шполянський р-н., Черкаська  обл.",1020,49.0519444,650,Черкаська,Інші,5021,"train,autocar","Шпола-Агро Індустрі, ТОВ (с. Сигнаївка)",Приватний,11300,31.4950000,"Товариство з обмеженою відповідальністю ""Шпола-Агро Індустрі"""
"66740, вул. Елеваторна, буд. 24, смт. Затишшя, Фрунзівський р-н., Одеська обл.",5000,47.3333333,5000,Одеська,Інші,5025,"train,autocar","Затишанське ХПП, ТДВ",Приватний,56700,29.8666667,"Товариство з додатковою відповідальністю ""Затишанське хлібоприймальне підприємство"""
"64501, вул. 17 Вересня, буд. 70, смт. Сахновщина, Харківська обл.",5350,49.1488889,5700,Харківська,Державні,5027,"train,autocar","ДПЗКУ, ПАТ (філія ""Сахновщинський елеватор"")",ДПЗКУ,110100,35.8744444,"Публічне акціонерне товариство ""Державна продовольчо-зернова корпорація України"""
"20000, вул. Першотравнева, буд. 1, м. Христинівка, Черкаська обл.",1400,48.8333333,1620,Черкаська,Державні,5030,"train,autocar","ДПЗКУ, ПАТ (філія ""Хлібна база № 86"")",ДПЗКУ,53200,29.9666667,"Публічне акціонерне товариство ""Державна продовольчо-зернова корпорація України"""
"30500, вул. Залізнична, буд. 27, м. Полонне, Хмельницька  обл.",400,50.1312110,800,Хмельницька,Інші,5033,"train,autocar","Полонський КХП, ПАТ",Приватний,25000,27.4996860,"Публічне акціонерне товариство ""Полонський комбінат хлібопродуктів"""
"51200, вул. Погрузна, буд. 4, м. Новомосковськ, Дніпропетровська обл.",320,48.634821,400,Дніпропетровська,Власники 6+,5051,autocar,"Розівський елеватор, ПАТ (Новомосковська філія) ",Розівський елеватор,20000,35.225378,"Публічне акціонерне товариство ""Розівський елеватор"""
"16730, вул. Шевченка, буд. 139, смт. Парафіївка, Ічнянський р-н., Чернігівська обл.",800,50.8746200,680,Чернігівська,Інші,5061,"train,autocar","Північно-Українська Експортно-Імпортна компанія, ТОВ",Приватний,11400,32.6398500,"Товариство з обмеженою відповідальністю ""ПІВНІЧНО-УКРАЇНСЬКА ЕКСПОРТНО-ІМПОРТНА КОМПАНІЯ"""
"17523, вул. Космонавтів, буд. 1-А, смт. Мала Дівиця, Прилуцький р-н., Чернігівська обл.",1260,50.6870783,1130,Чернігівська,Інші,5062,"train,autocar","Крок-УкрЗалізБуд, ТОВ",Приватний,33500,32.1719776,"Товариство з обмеженою відповідальністю ""КРОК - УкрЗалізБуд"""
"53610, вул. Пролетарська, буд. 1а, смт. Просяна, Покровський р-н., Дніпропетровська обл.",3600,48.1173570,4800,Дніпропетровська,Власники 6+,5064,"train,autocar","Сантрейд, ДП з ІІ (Просянська філія)",Сантрейд,195000,36.3742640,"Дочірнє підприємство з іноземною інвестицією ""Сантрейд"""
"19810, вул. Поштова, буд. 2, сел. Кононівка, Драбівський р-н., Черкаська обл.",1700,50.1916667,1000,Черкаська,Власники 6+,5065,"train,autocar","Кононівський елеватор, ТОВ  (ст. Кононівка)",Кернелл,46300,32.0919444,"Товариство з обмеженою відповідальністю ""Кононівський елеватор"""
"09200, вул. Фрунзе, буд. 95, м. Кагарлик,  Київська обл.",2700,49.8500000,2900,Київська,Інші,5072,"train,autocar","Комплекс Агромарс, ТОВ",Приватний,112600,30.8091667,"Товариство з обмеженою відповідальністю ""Комплекс Агромарс"""
"74800, вул. Леніна, буд. 124б, м. Каховка, Каховський р-н., Херсонська обл.",1800,46.8098389,1700,Херсонська,Інші,5073,"train,autocar","Судносервіс, ТОВ",Приватний,93000,33.484077,"Товариство з обмеженою відповідальністю ""Судносервіс"""
"37400, пров. Пирятинський, буд. 46, м. Гребінка, Полтавська обл.",1390,50.1183090,810,Полтавська,Державні,5078,"train,autocar","ДПЗКУ, ПАТ (філія ""Гребінківський елеватор"")",ДПЗКУ,83700,32.4522050,"Публічне акціонерне товариство ""Державна продовольчо-зернова корпорація України"""
"67300, вул. Пристанційна, буд. 14, м. Березівка, Березівський р-н., Одеська обл.",2700,47.2005556,2600,Одеська,Інші,5088,"train,autocar","Березівський елеватор, ТОВ (м. Березівка)",Приватний,80000,30.9172222,"Товариство з обмеженою відповідальністю ""Березівський елеватор"""
"67300, вул. Нова, буд. 82, с. Новоселівка, Березівський р-н., Одеська обл.",1100,46.0017330,1400,Одеська,Інші,5089,"train,autocar","Березівський елеватор, ТОВ (Раухівська дільниця)",Приватний,30000,29.6131410,"Товариство з обмеженою відповідальністю ""Березівський елеватор"""
"66410, вул. Степова, буд. 3, с. Жеребкове, Ананьївсьий р-н., Одеська обл.",800,47.8413440,300,Одеська,Інші,5092,"train,autocar","Бі єнд Вай, ДП",Приватний,5000,29.8710020,"Дочірнє підприємство ""Бі єнд Вай"""
"68200, вул. Заводська, буд. 9, смт. Сарата, Одеська обл.",3300,46.0199358,6800,Одеська,Власники 6+,5093,"train,autocar","Сантрейд, ДП з ІІ (смт. Сарата) (Саратська філія)",Сантрейд,164300,29.6734385,"Дочірнє підприємство з іноземною інвестицією ""Сантрейд"""
"26232, вул. П. Велігіна, буд. 9, с. Злинка, Маловисківський р-н., Кіровоградська обл.",1140,48.4911111,1500,Кіровоградська,Інші,5097,"train,autocar","Мосінвест, ТОВ",Приватний,44000,31.5375000,"Товариство з обмеженою відповідальністю ""Мосінвест"""
"53680, вул. Пушкіна, буд. 85, смт. Покровське, Дніпропетровська обл.",6640,47.9852870,3100,Дніпропетровська,Інші,5098,"train,autocar","Агрофірма Контрактова, ТОВ",Приватний,61400,36.2366700,"Товариство з обмеженою відповідальністю ""Агрофірма ""Контрактова"""
"31000, вул. Грушевського, буд. 148, м. Красилів, Хмельницька обл.",1300,49.6519444,1800,Хмельницька,Інші,5100,"train,autocar","Красилівське ПХП, ВАТ",Приватний,40100,26.9705556,"Відкрите акціонерне товариство ""Красилівське підприємство хлібопродуктів"""
"24600, вул. Радянська, буд. 6, смт. Крижопіль, Вінницька обл.",1100,48.3841667,1800,Вінницька,Інші,5102,"train,autocar","Крижопільський елеватор, ТОВ",Приватний,62900,28.8625000,"Товариство з обмеженою відповідальністю ""Крижопільський елеватор"""
"16572, вул. Перемоги, буд. 1, смт. Дмитрівка, Бахмацький р-н., Чернігівська обл.",750,51.4922222,1100,Чернігівська,Інші,5106,"train,autocar","Дмитрівське ЗПП, ПрАТ",Приватний,32000,31.8605556,"Приватне акціонерне товариство ""Дмитрівське зернопереробне підприємство"""
"72013, вул. 70 років Радянської влади, буд. 1, смт. Пришиб, Михайлівський р-н., Запорізька обл.",1000,47.236187,2000,Запорізька,Інші,5108,"train,autocar","Михайлівський райагропостач, ПрАТ",Приватний,25000,35.322289,"Приватне акціонерне товариство ""Михайлівський райагропостач"""
"70002, вул. Елеваторна, буд. 3, м. Вільнянськ, Запорізька обл.",660,47.9419444,1000,Запорізька,Інші,5109,"train,autocar","Вільнянський елеватор, ТОВ",Приватний,48000,35.4280556,"Товариство з обмеженою відповідальністю ""Вільнянський елеватор"""
"66410, вул. Привокзальна, буд. 4, с. Жеребкове, Ананьївський р-н., Одеська обл.",900,47.8413440,1000,Одеська,Інші,5110,"train,autocar","Кононівський елеватор, ТОВ",Приватний,34900,29.872002,"Товариство з обмеженою відповідальністю ""Кононівський елеватор"""
"24004, вул. Дністровська, буд  60, м. Могилів-Подільський, Вінницька обл.",720,48.4380240,720,Вінницька,Інші,5113,autocar,"ЛАН, ТОВ",Приватний,23000,27.8171620,"Товариство з обмеженою відповідальністю ""ЛАН"""
"37264, вул. Комарова, буд. 1, 1а,б,в,г,д, вул. Жовтнева, буд. 1а, с. Вирішальне, Лохвицький р-н., Полтавська оюл.",3500,50.191421,5000,Полтавська,Інші,5114,"train,autocar","Амарант, ТОВ (с. Вирішальне)",Приватний,50000,33.448799,"Товариство з обмеженою відповідальністю ""Амарант"""
"63312, вул. Нова, буд. 5. с. Ватутіне, Нововодолазький р-н., Харківська обл.",2640,49.791239,2200,Харківська,Інші,5116,"train,autocar","Агрофірма ""Україна Нова, СТОВ",Приватний,40000,36.025221,"Сільськогосподарське товариство з обмеженою відповідальністю Агрофірма ""Україна Нова"""
"08800, вул. Елеваторна, буд. 1, м. Мироніка, Київська обл.",2400,49.6500000,7200,Київська,Інші,5118,"train,autocar","Миронівський ЗВКК, ПАТ",Приватний,136000,30.9843333,"Публічне акціонерне товариство ""Миронівський завод по виготовленню круп і комбікормів"""
"71300, вул. Промислова, буд. 1, м. Кам\'янка-Дніпровська, Запорізька обл.",5000,47.50071,7000,Запорізька,Власники 6+,5119,"autocar,barge","НІБУЛОН СП, ТОВ (Кам\'янка-Дніпровська філія)",Нібулон,75200,34.39323,"Товариство з обмеженою відповідальністю сільськогосподарське товариство ""НІБУЛОН"""
"43022, вул. Мамсурова, буд. 10, м. Луцьк, Волинська обл.",1000,50.707595,1200,Волинська,Інші,5120,autocar,"Волинь-зерно-продукт, ТОВ (м. Луцьк)",Приватний,32000,25.32097,"Товариство з обмеженою відповідальністю ""Волинь-зерно-продукт"""
"45100, вул. Привокзальна, буд. 3, м. Рожище, Волинська обл.",550,50.9167000,1200,Волинська,Інші,5121,"train,autocar","Волинь-зерно-продукт, ТОВ (м. Рожище)",Приватний,9600,25.2667000,"Товариство з обмеженою відповідальністю ""Волинь-зерно-продукт"" "
"45750, вул. Привокзальна, буд. 90, смт. Сенкевичівка, Горохівський р-н., Волинська обл.",1100,50.5291667,800,Волинська,Інші,5122,"train,autocar","Волинь-зерно-продукт, ТОВ (смт. Сенкевичівка)",Приватний,15000,25.0383333,"Товариство з обмеженою відповідальністю ""Волинь-зерно-продукт"""""
"24032, вул. 50-річчя Жовтня, буд. 21-м, смт. Вендичани, Могилів-Подільський р-н., Вінницька обл.",700,48.6158333,500,Вінницька,Власники 6+,5123,"train,autocar",Елеваторна компанія Кусто ТОВ (смт. Вендичани),Кусто,10000,27.7963889,"Товариство з обмеженою відповідальністю ""Елеваторна компанія ""Кусто-Агро"""
"24633, вул. Службова, буд.1-Б, с. Соколівка, Крижопільський р-н., Вінницька обл.",700,48.4419444,500,Вінницька,Власники 6+,5124,"train,autocar",Елеваторна компанія Кусто ТОВ (с. Соколівка)),Кусто,10000,28.9922222,"Товариство з обмеженою відповідальністю ""Елеваторна компанія ""Кусто-Агро"""
"84112, вул. Свободи, буд. 85, м. Слов\'янськ, Донецька обл.",0,48.8532000,1200,Донецька,Інші,5125,"train,autocar","ТК Урожай, ТОВ (м. Слов\'янськ)",Приватний,48000,37.6053000,"Товариство з обмеженою відповідальністю ""Торгівельна компанія ""Урожай"""
"51325, вул. Пристанційна, буд. 26а, 26, с. Варварівка, Юр\'ївський р-н., Дніпропетровська обл.",2200,48.7056330,1850,Дніпропетровська,Інші,5126,"train,autocar","Павлоградзернопродукт, ТОВ",Приватний,37000,35.9879650,"Товариство з обмеженою відповідальністю ""Павлоградзернопродукт"""
"93008, вул. Київська, буд. 138, м. Рубіжне,  Луганська обл.",800,49.0108620,800,Луганська,Інші,5128,"train,autocar","Рубіжне-Агро, ТОВ",Приватний,19100,38.3740710,"Товариство з обмеженою відповідальністю ""Рубіжне-Агро"""
"98200, вул. Енгельса, буд. 30, смт. Леніне, АР Крим",1300,45.2975000,1210,АР Крим,Інші,5129,"train,autocar","Ленінське ХПП, ПрАТ",Приватний,24200,35.7738889,"Приватне акціонерне товариство ""Ленінське хлібоприймальне підприємство"""
"37710, вул. Ворошилова, буд. 1а, с. Лазірки, Оржицький р-н., Полтавська обл.",800,50.0830872,800,Полтавська,Інші,5130,"train,autocar","Агрострой, ТОВ (с. Лазірки)",Приватний,8000,32.6559079,"Товариство з обмеженою відповідальністю ""Агрострой"" "
"74330, с. Тягинка, Бериславський р-н., Херсонська обл.",2300,46.7816667,1000,Херсонська,Інші,5131,"train,autocar,ship,barge","Тягінське ХПП, ТОВ",Приватний,14500,33.0538889,"Товариство з обмеженою відповідальністю ""Тягінське хлібоприймальне підприємство"""
"74612, вул. Горностаївська, буд. 1а, с. Каїри, Горностаївський р-н., Херсонська обл.",3540,46.9466667,2160,Херсонська,Інші,5132,"autocar,ship,barge","ЗПП Зерно Таврії, ТОВ",Приватний,36900,33.7030556,"Товариство з обмеженою відповідальністю ""Зернопереробне підприємство ""Зерно Таврії"""
"09800, вул. Київська, буд. 27, м. Тетіїв, Київська обл.",1400,49.3708333,1800,Київська,Інші,5133,"train,autocar","Тетіївське ХПП, ПАТ",Приватний,45500,29.6900000,"Публічне акціонерне товариство ""Тетіївське хлібоприймальне підприємство"""
"51660, вул. Вокзальна, буд. 19, м. Верховцеве, Дніпропетровська обл.",700,48.4833333,400,Дніпропетровська,Інші,5134,"train,autocar","Верховцевський елеватор, ТОВ",Приватний,16900,34.2500000,"Товариство з обмеженою відповідальністю ""Верховцевський елеватор"""
"56602, вул. Решетєєва, буд. 79, м. Нова Одеса, Миколаївська обл.",2000,47.2933120,1500,Миколаївська,Інші,5135,"train,autocar,barge","Новоодеський елеватор, ТОВ",Приватний,66600,31.79468,"Товариство з обмеженою відповідальністю ""Новоодеський елеватор"""
"39500, вул. Огородня, буд. 1в, м. Карлівка, Полтавська обл.",800,49.4500000,800,Полтавська,Інші,5136,"train,autocar","Агрострой, ТОВ (м. Карлівка)",Приватний,8000,35.1333333,"Товариство з обмеженою відповідальністю ""Агрострой"""
"66502, вул. Спортивна, буд. 4а, смт. Любашівка, Одеська обл.",2900,47.0833333,3900,Одеська,Інші,5137,"train,autocar","Любашівський елеватор, ПрАТ",Приватний,78700,30.0333333,"Приватне акціонерне товариство ""Любашівський елеватор"""
