elevatorAddress,unloadCapacity,lat,loadCapacity,odhiRegion,propertyTypeCategory,cert,transportTypes,shortName,propertyType,capacity,lng,fullName
"16624, вул. Крапив\'янського, буд. б/н, село Вертіївка, Ніжинський р-н., Чернігівська обл.",800,51.1641667,800,Чернігівська,Інші,5471,"train,autocar","Ніжин Агро, ТОВ",Приватний,24000,31.8458333,"Товариство з обмеженою відповідальністю ""НІЖИН АГРО"""
"85710, вул. Поштова, буд. 147, смт. Оленівка, Волноваський р-н., Донецька обл.",7400,47.8333333,7800,Донецька,Державні,5472,"train,autocar","ДПЗКУ, ПАТ (філія Оленівський КХП)",ДПЗКУ,60400,37.6500000,"Публічне акціонерне товариство ""Державна продовольчо-зернова корпорація України"""
"13045, вул. Центральна, буд. 1а, с. Печанівка, Романівський р-н., Житомирська обл.",1000,50.0733333,1000,Житомирська,Інші,5473,"train,autocar","А.Т.К., ТОВ",Приватний,87900,27.7936111,"Товариство з обмеженою відповідальністю ""А.Т.К."""
"22100, вул. Довженка, буд. 12, м. Козятин, Вінницька обл. ",840,49.7205520,3450,Вінницька,Інші,5474,"train,autocar","Зернокомплекс Сиваш, ТОВ",Приватний,51800,28.850069,"Товариство з обмеженою відповідальністю ""ЗЕРНОКОМПЛЕКС СИВАШ"""
"36007, вул. Маршала Бірюзова, буд. 43а, м. Полтава   ",1500,49.599453,1500,Полтавська,Інші,5475,"train,autocar","Бурат, ТОВ",Приватний,54000,34.508829,"Товариство з обмеженою відповідальністю ""Бурат"""
"84700, вул. Мокієвської, буд. 1,  м. Дебальцеве, Донецька обл.",600,48.333145,600,Донецька,Інші,5476,"train,autocar","Прометей Плюс, ТОВ",Приватний,8000,38.404908,"Товариство з обмеженою відповідальністю ""Прометей Плюс"""
"20910, вул. Портова, буд. 9, с. Рацеве, Чигиринський р-н., Черкаська обл.",800,49.1408333,800,Черкаська,Інші,5477,autocar,"Інвестджерело, ТОВ (комплекс ХПП)",Приватний,31600,32.7041667,"Товариство з обмеженою відповідальністю ""Інвестджерело"""
"72501, вул. Курортна, буд. 1, смт. Якимівка, Запорізька обл.",1020,46.6966969,1120,Запорізька,Власники 6+,5478,"train,autocar","Розівський елеватор, ПАТ (філія Якимівський елеватор)",Розівський елеватор,27000,35.1663579,"Публічне акціонерне товариство ""Розівський елеватор"" "
"72500, вул. Леніна, буд. 68, смт. Якимівка, Запорізька обл.",1000,46.6966969,1000,Запорізька,Інші,5479,autocar,"Аскон, ПП",Приватний,16500,35.1673579,"Приватне підприємство ""Аскон"""
"45070, вул. Ткача, буд. 1, смт. Голоби, Ковельський р-н., Волинська обл.",650,51.0825000,650,Волинська,Інші,5480,"train,autocar","Гранд Інвест Лімітед, ТОВ",Приватний,9600,25.0108333,"Товариство з обмеженою відповідальністю ""Гранд Інвест Лімітед"""
"22525, вул. Чкалова, буд. 29-Е, с. Зозів, Липовецький р-н., Вінницька обл.",1800,49.3175000,2200,Вінницька,Інші,5481,autocar,"Концерн Сімекс-Агро, ТОВ",Приватний,33000,29.0138889,"Товариство з обмеженою відповідальністю ""Концерн ""Сімекс-Агро"""
"37000, вул. Фабрична, буд. 17, м. Пирятин, Пирятинський р-н., Полтавська обл.  ",1700,50.2373930,4600,Полтавська,Державні,5482,"train,autocar","ДПЗКУ, ПАТ (філія ""Пирятинський КХП"" (вул. Фабрична)",ДПЗКУ,24300,32.505928,"Публічне акціонерне товариство ""Державна продовольчо-зернова корпорація України"""
"52012, вул. Леніна, буд. 18а, с. Партизанське, Дніпропетровський р-н., Дніпропетровська обл.",1800,48.5878900,4400,Дніпропетровська,Інші,5483,"train,autocar","Компанія Грейнфілд"", ТОВ (Балівський елеватор)",Приватний,147000,34.8111900,"Товариство з обмеженою відповідальністю ""Компанія ""Грейнфілд"""
"63523, вул. ім. В Вєсіча, буд. 1, смт. Новопокровка, Чугуївський р-н., Харківська обл.",2240,49.8350000,5580,Харківська,Державні,5484,"train,autocar","Новопокровський КХП, ДП ДАРУ",ДАРУ,68300,36.5470000,"Державне підприємство ""Новопокровський комбінат хлібопродуктів"" Державного агенства резерву України"
"63451, вул. Польова, буд. 1в, с. Пасіки, Зміївський р-н., Харківська обл.",500,49.5811020,800,Харківська,Інші,5485,"train,autocar","Беспалівське ХПП, ТОВ",Приватний,17100,36.1944480,"Товариство з обмеженою відповідальністю ""Беспалівське хлібоприймальне підприємство"""
"61139, вул. Котлова, буд. 236, м. Харків   ",500,50.031921,700,Харківська,Інші,5486,"train,autocar","Харківський ККЗ, ПАТ",Приватний,35400,36.180854,"Публічне акціонерне товариство ""Харківський комбікормовий завод"""
"24300, вул. Наконечного, буд. 31, смт. Тростянець, Вінницька обл.",200,48.5127778,200,Вінницька,Інші,5487,autocar,"Тростянецьзерно, ТОВ",Приватний,12200,29.2287778,"Товариство з обмеженою відповідальністю ""Тростянецьзерно"""
"45000, вул. Брестська, буд. 137, м. Ковель, Ковельський   р-н., Волинська обл.",150,51.237397,150,Волинська,Інші,5488,autocar,Ковельський МКЗ,Приватний,7200,24.694646,Ковельський міжгосподарський комбікормовий завод
"94420, вул. Заготзерно, буд. 1, м. Суходільськ, Краснодонський р-н., Луганська обл.",600,48.3489600,600,Луганська,Інші,5489,"train,autocar","Краснодонське ХПП, ТОВ",Приватний,15700,39.7185700,"Товариство з обмеженою відповідальністю ""Краснодонське хлібоприймальне підприємство"""
"51040, вул. Дніпропетровська, буд. 106, село Могилів, Царичанський р-н., Дніпропетровська обл.",200,48.8606245,200,Дніпропетровська,Власники 6+,5490,autocar,"НЗК, ТОВ (філія Могилівський ХПП)",Нікопольська ЗК,13200,34.4950420,"Товариство з обмеженою відповідальністю ""Нікопольська зернова компанія"""
"74331, вул. Набережна, село Львове, Бериславський р-н., Херсонська обл.",1500,46.7938889,1500,Херсонська,Інші,5491,"autocar,ship,barge","АВЕ, ТОВ",Приватний,17000,33.1519444,"Товариство з обмеженою відповідальністю ""АВЕ"""
"27405, вул. Осадчого, буд. 95, м. Знам\'янка, Кіровоградська обл.",3000,48.715997,3000,Кіровоградська,Інші,5492,"train,autocar","АСТІ Знаменський елеватор, ТОВ",Приватний,70000,32.672971,"Товариство з обмеженою відповідальністю ""АСТІ Знаменський елеватор"""
"38813, вул. Першотравнева, буд. 9, смт. Артемівка, Чутівський р-н., Полтавська обл.",6000,49.7712069,6000,Полтавська,Власники 6+,5493,"train,autocar","НІБУЛОН СП, ТОВ (філія Артемівська)",Нібулон,75600,35.065665,"Товариство з обмеженою відповідальністю сільськогосподарське підприємство ""НІБУЛОН"""
"75200, вул. Івана Кудрі, буд. 1, смт. Чаплинка, Чаплинський р-н., Херсонська обл.",500,46.3628750,500,Херсонська,Інші,5494,autocar,"Чаплинський ККЗ, ЗАТ",Приватний,20700,33.5302028,"Закрите акціонерне товариство ""Чаплинський комбікормовий завод"""
"41304, вул. Транспортна, буд. 1, м. Кролевець, Сумська обл.",1800,51.5500000,3600,Сумська,Інші,5495,"train,autocar","Кролевецький елеватор, ТОВ",Приватний,65000,33.3843333,"Товариство з обмеженою відповідальністю ""Кролевецький елеватор"""
"42200, вул. Залізнична, буд. 50, м. Лебедин, Сумська обл.",800,50.5797222,1000,Сумська,Інші,5496,"train,autocar","Крук, ТОВ",Приватний,27000,34.4772222,"Товариство з обмеженою відповідальністю ""Крук"""
"13343, вул. Чуднівська, буд. 104, с. Скраглівка, Бердичівський р-н., Житомирська обл.",1200,49.9425000,1200,Житомирська,Інші,5497,autocar,"Скраглівське ХЗП, ТОВ",Приватний,11000,28.5427778,"Товариство з обмеженою відповідальністю ""Скраглівське хлібозаготівельне підприємство"""
"42200, вул. Леніна, буд. 102, м. Лебедин, Сумська обл.",498,50.5797222,500,Сумська,Інші,5498,"train,autocar","Лебедин АПК, ТОВ",Приватний,8000,34.4782222,"Товариство з обмеженою відповідальністю ""Агропромислова компанія ""Лебедин"""
"08420, вул. Привокзальна, буд. 2, с. Переяславське, Переяслав-Хмельницький р-н., Київська обл.",2200,50.2638889,1740,Київська,Інші,5499,"train,autocar","Переяславський ЕКХП, ПАТ",Приватний,63650,31.6575000,"Публічне акціонерне товариство ""Переяславський експериментальний комбінат хлібопродуктів"""
"68000, вул. Сухолиманська, буд. 58, м. Іллічівськ, Одеська обл.",36000,46.310181,16640,Одеська,Інші,5500,"train,autocar,ship","Трансбалктермінал, СП ТОВ",Приватний,190000,30.663133,"Спільне підприємство у вигляді товариства з обмеженою відповідальністю ""Трансбалктермінал"""
"67832, вул. Мизикевича, буд. 61, смт. Великодолинське, Овідіопольський р-н., Одеська обл.",1000,46.3533710,1000,Одеська,Інші,5501,"train,autocar","УСПІХ АТС, ТОВ",Приватний,9900,30.5860600,"Товариство з обмеженою відповідальністю ""АТС УСПІХ"""
"72100, вул. Чапаєва, буд. 8а, м. Приморськ, Запорізька обл.",780,46.730129,1060,Запорізька,Інші,5502,autocar,"Приморський агротехсервіс, ТОВ (м. Приморськ)",Приватний,6000,36.347981,"Товариство з обмеженою відповідальністю ""Приморський агротехсервіс"""
"72151, вул. Польова, буд. 2, с. Борисівка, Приморський р-н., Запорізька обл.",780,46.7851440,1060,Запорізька,Інші,5503,autocar,"Приморський агротехсервіс, ТОВ (с. Борисівка)",Приватний,14000,36.4080050,"Товариство з обмеженою відповідальністю ""Приморський агротехсервіс"""
"72100, вул. Курортна, буд. 89, м. Приморськ, Запорізька обл.",700,46.712094,700,Запорізька,Власники 6+,5504,autocar,"Розівський елеватор, ПАТ (філія Приморський ХПП)",Розівський елеватор,14000,36.365781,"Публічне акціонерне товариство ""Розівський елеватор"""
"71151, вул. Шкільна, буд. 1, с. Трояни, Бердянський р-н., Запорізька обл.",3000,46.8767145,3000,Запорізька,Власники 6+,5505,"train,autocar","Розівський елеватор, ПАТ (філія Троянівський елеватор)",Розівський елеватор,44400,36.6067104,"Публічне акціонерне товариство ""Розівський елеватор"""
"48173, вул. Промислова, буд. 11, с. Деренівка, Теребовлянський р-н., Тернопільська обл.",1980,49.2302778,2500,Тернопільська,Інші,5506,"train,autocar","Елагрі-Деренівка, ТОВ (с. Деренівка)",Приватний,105000,25.7475000,"Товариство з обмеженою відповідальністю ""ЕЛАГРІ-ДЕРЕНІВКА"""
"24032, вул. 50-річчя Жовтня, буд. 23, смт. Вендичани, Могилів-Подільський р-н., Вінницька обл.",1080,48.6158333,2740,Вінницька,Інші,5507,"train,autocar","Агроком Логістика, ТОВ (філія Вендичанський КХП)",Приватний,61400,27.7973889,"Товариство з обмеженою відповідальністю ""Агроком Логістика"""
"20635, вул. Заводська, буд. 17, с. Лебедин, Шполянський р-н., Черкаська обл.",900,48.9641667,1100,Черкаська,Інші,5508,"train,autocar","Лебединський насіннєвий завод, ПАТ",Приватний,49500,31.5225000,"Публічне акціонерне товариство ""Лебединський насіннєвий завод"""
"22850, вул. Набережна, буд. 51, с. Кароліна, Немирівський р-н., Вінницька обл.",540,48.9286111,620,Вінницька,Інші,5509,"train,autocar","Немирівський ККЗ, ТОВ",Приватний,12700,28.9601667,"Товариство з обмеженою відповідальністю ""Немирівський комбікормовий завод"""""
"35523, вул. 40-Річчя Перемоги 115в, с.Зарічне, Радивилівський район, Рівненська область",250,51.3278320,200,Рівненська,Інші,5510,autocar,"Агротехніка, ТзОВ",Приватний,0,28.8133440,"Товариство з обмеженою відповідальністю ""Агротехніка"""
"94700, вул. Вигонна, буд. 7, м. Ровеньки, Луганська обл.",670,48.0833333,740,Луганська,Інші,5511,"train,autocar","Слобода РКЗ, ТОВ",Приватний,34800,39.3666667,"Товариство з обмеженою відповідальністю ""Ровеньківський комбікормовий завод ""Слобода"""
"56525, вул. Кожедуба, буд. 103, с. Мартинівське, Вознесенський р-н., Миколаївська обл.",300,47.4725705,600,Миколаївська,Державні,5512,autocar,"Хлібна база № 76, ДП ДАРУ (с. Мартинівське)",ДАРУ,20100,31.2761384,"Державне підприємство ""Хлібна база № 76"" Державного агенства резерву України"
"15100, вул. Вокзальна, буд. 18, м. Городня, Чернігівська обл.",650,51.8905556,750,Чернігівська,Інші,5513,"train,autocar","Городнянське ХПП, ТОВ",Приватний,15000,31.5936111,"Товариство з обмеженою відповідальністю ""Городнянське хлібоприймальне підприємство"""
"19842, вул. Гоголя, буд. 15, с. Драбове-Барятинське, Драбівський р-н., Черкаська обл.",850,49.9450000,710,Черкаська,Інші,5515,"train,autocar","Шеколан, ТОВ",Приватний,12000,32.2905556,"Товариство з обмеженою відповідальністю ""Шеколан"""
"27410, вул. Леніна, буд. 1, с. Мошорине, Знам\'янський р-н., Кіровоградська обл.",10000,48.6196790,10000,Кіровоградська,Інші,5516,autocar,"Рос Агро, ТОВ",Приватний,20000,32.7138480,"Товариство з обмеженою відповідальністю ""РОС АГРО"""
"27200, вул. Промислова, буд. 1а, м. Бобринець, Кіровоградська обл.",300,48.0510670,500,Кіровоградська,Власники 6+,5517,autocar,"АФ Славутич, ПП",Кернелл,20000,32.1675690,"Приватне підприємство Агрофірма ""Славутич"""
"27030, вул. Гагаріна, буд. 56а, м. Помічна, Добровеличківський р-н., Кіровоградська обл.",800,48.2500000,800,Кіровоградська,Інші,5518,"train,autocar","Агромаркет ТК, ТОВ (м. Помічна)",Приватний,10000,31.4166667,"Товариство з обмеженою відповідальністю ""Торгова компанія ""Агромаркет"""
"28227, вул. Привокзальна, буд. 11, с. Куцівка, Новгородківський р-н., Кіровоградська обл.",800,48.3147222,800,Кіровоградська,Інші,5519,"train,autocar","Агромаркет ТК, ТОВ (с. Куцівка)",Приватний,2000,32.7908333,"Товариство з обмеженою відповідальністю ""Торгова компанія ""Агромаркет"""
"55604, вул. Жовтнева, буд. 27а, с. Шевченкове, Новобузький р-н., Миколаївська обл.",900,46.8614630,400,Миколаївська,Інші,5520,"train,autocar","Прометей-Елеватор, ТОВ (с. Шевченкове)",Приватний,16000,32.2021940,"Товариство з обмеженою відповідальністю ""Прометей-Елеватор"""
"56180, вул. Степаненка, буд. 68а, с. Лоцкине, Баштанський р-н., Миколаївська обл.",600,47.2027778,400,Миколаївська,Інші,5521,"train,autocar","Прометей-Елеватор, ТОВ (с. Лоцкине)",Приватний,18500,32.3841667,"Товариство з обмеженою відповідальністю ""Прометей-Елеватор"""
"52170, вул. П\'ятихатська, буд. 52, 52а, с. Красноіванівка, П\'ятихатський р-н., Дніпропетровська обл.",550,48.3558789,550,Дніпропетровська,Інші,5522,autocar,"Млин, ТОВ",Приватний,11000,33.7310076,"Товариство з обмеженою відповідальністю ""Млин"""
"53132, вул. Чкалова, буд. 5, с. Девладове, Софіївський р-н., Дніпропетровська обл.",3680,48.1029157,5000,Дніпропетровська,Власники 6+,5523,"train,autocar","Полтавське ХПП, ПрАТ (Девладівська дільниця)",Кернелл,61380,33.7559557,"Приватне акціонерне товариство ""Полтавське хлібоприймальне підприємство"""
"07805, вул. Привокзальна, буд. 42, смт. Бородянка, Київська обл.",330,50.6438889,270,Київська,Інші,5524,"train,autocar","Бородянське ХПП, ТОВ",Приватний,5240,29.9338889,"Товариство з обмеженою відповідальністю ""Бородянське хлібоприймальне підприємство"""
"51200, вул. Тургенєва, буд. 16, м. Новомосковськ, Дніпропетровська обл.",300,48.63181,400,Дніпропетровська,Власники 6+,5525,"train,autocar","Полтавське ХПП, ПрАТ (Новомосковська дільниця)",Кернелл,10000,35.204753,"Приватне акціонерне товариство ""Полтавське хлібоприймальне підприємство"""
"72200, вул. Чапаєва, буд. 1а, смт. Веселе, Запорізька обл.",600,47.0159935,700,Запорізька,Інші,5526,"train,autocar","Таврія-Агропром, ТОВ",Приватний,32000,34.9123809,"Товариство з обмеженою відповідальністю ""ТАВРІЯ-АГРОПРОМ"""
"37650, вул. Гарбузенка, буд. 2, смт. Ромодан, Миргородський р-н., Полтавська обл.",6000,49.9948749,6000,Полтавська,Власники 6+,5527,"train,autocar","НІБУЛОН СП, ТОВ (філія Ромодан)",Нібулон,77128,33.3307307,"Товариство з обмеженою відповідальністю сільськогосподарське підприємство ""НІБУЛОН"""
"38100, вул. Фрунзе, буд. 146, м. Зіньків, Полтавська обл.",200,50.2085210,300,Полтавська,Інші,5528,autocar,"Зіньківський ККЗ, ТДВ",Приватний,11200,34.3683220,"Товариство з додатковою відповідальністю ""Зіньківський комбікормовий завод"""
"24032, вул. Леніна, буд. 169, смт. Шпиків, Тульчинський р-н., Вінницька обл.",1000,48.7883930,1000,Вінницька,Власники 6+,5529,autocar,Елеваторна компанія Кусто ТОВ,Кусто,42000,28.5701880,"Товариство з обмеженою відповідальністю ""Елеваторна компанія ""Кусто-Агро"""
"26533, вул. Леніна, буд. 2, с-ще. Ємилівка, Голованівський р-н., Кіровоградська обл.",800,48.3769444,1000,Кіровоградська,Інші,5530,"train,autocar","Ємилівське ХПП, ТОВ",Приватний,60000,30.6050000,"Товариство з обмеженою відповідальністю ""Ємилівське хлібоприймальне підприємство"""
"23800, вул. І. Франка, буд. 79, смт. Теплик, Вінницька обл.",1000,48.6594444,1000,Вінницька,Інші,5532,autocar,"Теплицький КХП, ТОВ",Приватний,20000,29.7538889,"Товариство з обмеженою відповідальністю ""Теплицький комбінат хлібопродуктів"""
"39075, вул. Жовтнева, буд. 104, с. Погреби, Глобинський р-н., Полтавська обл. ",500,49.2503006,1000,Полтавська,Інші,5533,"train,autocar","Агрофірма Мічуріна, ТОВ",Приватний,40800,33.3181109,"Товариство з обмеженою відповідальністю ""Агрофірма Мічуріна"""
"19741, вул. Шевченка, буд. 67, с. Вознесенське, Золотоніський р-н., Черкаська обл.",780,49.7586111,2000,Черкаська,Державні,5534,"train,autocar","Златодар, ДП ДАРУ (с. Вознесенське)",ДАРУ,36500,32.1622222,"Державне підприємство ""Златодар"" "
